{
	"$schema": "http://json-schema.org/draft-07/schema#",
	"$id": "https://ofn.gov.cz/vstupné/draft/schémata/vstupné.json",
	"type": "object",
	"title": "Vstupné",
	"properties": {
		"iri": {
			"$id": "#/properties/iri",
			"type": "string",
			"format": "iri",
			"title": "Identifikátor",
			"examples": [
				"https://www.trebic.cz/zdroj/aktualita/2020/dopadení-lupiče-na-francouzské-ulici"
			]
		},
		"název": {
			"$ref": "https://ofn.gov.cz/základní-datové-typy/draft/schémata/text.json"
		},
		"popis": {
			"$ref": "https://ofn.gov.cz/základní-datové-typy/draft/schémata/text.json"
		},
		"vytvořeno": {
			"$ref": "https://ofn.gov.cz/základní-datové-typy/draft/schémata/časový-okamžik.json"
		},
		"relevantní_do": {
			"$ref": "https://ofn.gov.cz/základní-datové-typy/draft/schémata/časový-okamžik.json"
		},
		"zneplatněno": {
			"$ref": "https://ofn.gov.cz/základní-datové-typy/draft/schémata/časový-okamžik.json"
		},
		"příloha": {
			"$ref": "https://ofn.gov.cz/přílohy/draft/schémata/přílohy.json"
		},
		"podmínka": {
			"$ref": "https://ofn.gov.cz/základní-datové-typy/draft/schémata/text.json"
		},
		"platnost": {
			"$ref": "https://ofn.gov.cz/časová-specifikace/draft/schémata/časová-specifikace.json"
		},
		"částka": {
			"$ref": "https://ofn.gov.cz/základní-datové-typy/draft/schémata/částka.json"
		}
	}
}