[{
    "název": {
        "cs": "Studentské vstupné"
    },
    "podmínka": {
        "cs": "Pro získání studentského vstupného je zapotřebí předložit kartu ISIC.\nStudent musí zároveň mít méně než 26."
    },
    "platnost": {
        "vznik_časové_platnosti": {
            "datum_a_čas": "2019-08-01T09:30:00+02:00"
        },
        "ukončení_časové_platnosti": {
            "datum_a_čas": "2019-08-07T18:00:00+02:00"
        }
    },
    "částka": {
            "výše": 289.90,
            "měna": "CZK"
    }

}]